{
  "schema_version": 1,
  "date": "2026-08-10",
  "runtime": {
    "surface": "github-copilot",
    "qualified_client_surface": "github-copilot-cli",
    "other_surfaces": [
      "vscode-agent-mode: separate-runtime-qualification-not-performed"
    ]
  },
  "client_version": "GitHub Copilot CLI 1.0.78.\r\nRun 'copilot update' to check for updates.",
  "model_requested": null,
  "model_observed": "client-selected-or-unobserved",
  "apm_version": "Agent Package Manager (APM) CLI version 0.26.0",
  "candidate_commit": "2a4075dc39bee365ece0b82ba5377005715e8270-dirty",
  "plan_coverage_package_version": "0.13.0",
  "canonical_fingerprint": "98a49a9a3efa807363d3f4411f01f15992642fd1f4224fa8d8a57de2aa0e4ffb",
  "apm_yml_sha256": "a675c88e51bcbeef22af9e5637486ddbd72d70d2b5359228304773b8c834ed35",
  "install_targets": [
    "copilot",
    "codex",
    "agent-skills"
  ],
  "apm_lock_sha256": "2fe818c08c751c26b231b5af039836394806a6349ceb8675868efde76e6dfabb",
  "platform": "Win32NT",
  "distribution_smoke": {
    "status": "PASS",
    "command": "./apm-packages/plan-coverage-residual-flow/scripts/validate-plan-coverage-residual-flow-apm-smoke.ps1",
    "rationale": "Fresh APM install smoke passed (copilot,codex,agent-skills + transitive Adaptive + installed E2E when remote)."
  },
  "overall_status": "FAIL",
  "qualification_matrix_notes": "Qualified client surface is GitHub Copilot CLI only. Codex was not re-qualified in this run beyond existing static/historical evidence. VS Code Agent mode was not runtime-qualified.",
  "scenarios": [
    {
      "id": "A",
      "kind": "authorization-negative",
      "exact_prompt": "実装して",
      "upstream_route_evidence": null,
      "exit_code": 1,
      "skill_observation": "UNOBSERVABLE",
      "agents_observed": [],
      "created_artifacts": [
        "QUALIFICATION_PROMPT.md"
      ],
      "changed_artifacts": [],
      "verifier_results": [],
      "route_observed": null,
      "verdict": "caller-or-normal-route",
      "stop_reason": null,
      "status": "PASS",
      "rationale": "No Plan Coverage agents, artifact writes, or route recommendations observed.",
      "transcript_sha256": "e3b0c44298fc1c149afbf4c8996fb92427ae41e4649b934ca495991b7852b855",
      "hook_log_sha256": "e3b0c44298fc1c149afbf4c8996fb92427ae41e4649b934ca495991b7852b855",
      "evidence_boundary": "skill_observation=UNOBSERVABLE; judged from hooks/agents, artifact delta, and final response."
    },
    {
      "id": "B",
      "kind": "authorization-negative",
      "exact_prompt": "実装して",
      "upstream_route_evidence": null,
      "exit_code": 1,
      "skill_observation": "UNOBSERVABLE",
      "agents_observed": [],
      "created_artifacts": [
        "QUALIFICATION_PROMPT.md"
      ],
      "changed_artifacts": [],
      "verifier_results": [],
      "route_observed": null,
      "verdict": "caller-or-normal-route",
      "stop_reason": null,
      "status": "PASS",
      "rationale": "No Plan Coverage agents, artifact writes, or route recommendations observed.",
      "transcript_sha256": "e3b0c44298fc1c149afbf4c8996fb92427ae41e4649b934ca495991b7852b855",
      "hook_log_sha256": "e3b0c44298fc1c149afbf4c8996fb92427ae41e4649b934ca495991b7852b855",
      "evidence_boundary": "skill_observation=UNOBSERVABLE; judged from hooks/agents, artifact delta, and final response."
    },
    {
      "id": "C",
      "kind": "authorization-negative",
      "exact_prompt": "この変更を続けて",
      "upstream_route_evidence": null,
      "exit_code": 1,
      "skill_observation": "UNOBSERVABLE",
      "agents_observed": [],
      "created_artifacts": [
        "QUALIFICATION_PROMPT.md"
      ],
      "changed_artifacts": [],
      "verifier_results": [],
      "route_observed": null,
      "verdict": "caller-or-normal-route",
      "stop_reason": null,
      "status": "PASS",
      "rationale": "No Plan Coverage agents, artifact writes, or route recommendations observed.",
      "transcript_sha256": "e3b0c44298fc1c149afbf4c8996fb92427ae41e4649b934ca495991b7852b855",
      "hook_log_sha256": "e3b0c44298fc1c149afbf4c8996fb92427ae41e4649b934ca495991b7852b855",
      "evidence_boundary": "skill_observation=UNOBSERVABLE; judged from hooks/agents, artifact delta, and final response."
    },
    {
      "id": "D",
      "kind": "authorization-positive",
      "exact_prompt": "plan-coverage-residual-flowを使って実装して",
      "upstream_route_evidence": null,
      "exit_code": 1,
      "skill_observation": "UNOBSERVABLE",
      "agents_observed": [],
      "created_artifacts": [
        "QUALIFICATION_PROMPT.md"
      ],
      "changed_artifacts": [],
      "verifier_results": [],
      "route_observed": null,
      "verdict": null,
      "stop_reason": null,
      "status": "FAIL",
      "rationale": "Expected authorization acceptance was not observed in agents or final response.",
      "transcript_sha256": "e3b0c44298fc1c149afbf4c8996fb92427ae41e4649b934ca495991b7852b855",
      "hook_log_sha256": "e3b0c44298fc1c149afbf4c8996fb92427ae41e4649b934ca495991b7852b855",
      "evidence_boundary": "skill_observation=UNOBSERVABLE; judged from hooks/agents, artifact delta, and final response."
    },
    {
      "id": "E",
      "kind": "authorization-negative",
      "exact_prompt": null,
      "upstream_route_evidence": {
        "process_route": "plan-coverage-residual-flow"
      },
      "exit_code": 1,
      "skill_observation": "UNOBSERVABLE",
      "agents_observed": [],
      "created_artifacts": [
        "QUALIFICATION_PROMPT.md"
      ],
      "changed_artifacts": [],
      "verifier_results": [],
      "route_observed": null,
      "verdict": "caller-or-normal-route",
      "stop_reason": null,
      "status": "PASS",
      "rationale": "No Plan Coverage agents, artifact writes, or route recommendations observed.",
      "transcript_sha256": "e3b0c44298fc1c149afbf4c8996fb92427ae41e4649b934ca495991b7852b855",
      "hook_log_sha256": "e3b0c44298fc1c149afbf4c8996fb92427ae41e4649b934ca495991b7852b855",
      "evidence_boundary": "skill_observation=UNOBSERVABLE; judged from hooks/agents, artifact delta, and final response."
    },
    {
      "id": "F",
      "kind": "authorization-positive",
      "exact_prompt": null,
      "upstream_route_evidence": {
        "process_route": "plan-coverage-residual-flow",
        "process_route_source": "explicit-user-selection",
        "user_selection_evidence": "user-turn:42"
      },
      "exit_code": 1,
      "skill_observation": "UNOBSERVABLE",
      "agents_observed": [],
      "created_artifacts": [
        "QUALIFICATION_PROMPT.md"
      ],
      "changed_artifacts": [],
      "verifier_results": [],
      "route_observed": null,
      "verdict": null,
      "stop_reason": null,
      "status": "FAIL",
      "rationale": "Expected authorization acceptance was not observed in agents or final response.",
      "transcript_sha256": "e3b0c44298fc1c149afbf4c8996fb92427ae41e4649b934ca495991b7852b855",
      "hook_log_sha256": "e3b0c44298fc1c149afbf4c8996fb92427ae41e4649b934ca495991b7852b855",
      "evidence_boundary": "skill_observation=UNOBSERVABLE; judged from hooks/agents, artifact delta, and final response."
    },
    {
      "id": "G",
      "kind": "authorization-negative",
      "exact_prompt": "plan-coverage-residual-flowは使わず、通常の実装ルートで進めて",
      "upstream_route_evidence": null,
      "exit_code": 1,
      "skill_observation": "UNOBSERVABLE",
      "agents_observed": [],
      "created_artifacts": [
        "QUALIFICATION_PROMPT.md"
      ],
      "changed_artifacts": [],
      "verifier_results": [],
      "route_observed": null,
      "verdict": "caller-or-normal-route",
      "stop_reason": null,
      "status": "PASS",
      "rationale": "No Plan Coverage agents, artifact writes, or route recommendations observed.",
      "transcript_sha256": "e3b0c44298fc1c149afbf4c8996fb92427ae41e4649b934ca495991b7852b855",
      "hook_log_sha256": "e3b0c44298fc1c149afbf4c8996fb92427ae41e4649b934ca495991b7852b855",
      "evidence_boundary": "skill_observation=UNOBSERVABLE; judged from hooks/agents, artifact delta, and final response."
    },
    {
      "id": "H",
      "kind": "authorization-negative",
      "exact_prompt": "plan-coverage-residual-flowが自動選択された理由を説明して",
      "upstream_route_evidence": null,
      "exit_code": 1,
      "skill_observation": "UNOBSERVABLE",
      "agents_observed": [],
      "created_artifacts": [
        "QUALIFICATION_PROMPT.md"
      ],
      "changed_artifacts": [],
      "verifier_results": [],
      "route_observed": null,
      "verdict": "caller-or-normal-route",
      "stop_reason": null,
      "status": "PASS",
      "rationale": "No Plan Coverage agents, artifact writes, or route recommendations observed.",
      "transcript_sha256": "e3b0c44298fc1c149afbf4c8996fb92427ae41e4649b934ca495991b7852b855",
      "hook_log_sha256": "e3b0c44298fc1c149afbf4c8996fb92427ae41e4649b934ca495991b7852b855",
      "evidence_boundary": "skill_observation=UNOBSERVABLE; judged from hooks/agents, artifact delta, and final response."
    },
    {
      "id": "STD-001",
      "kind": "standard-slice-e2e",